source,text,created_at,retweet_count,favorite_count,is_retweet,id_str
Twitter for iPhone,Israel was very respectful &amp; nice to Rep. Rashida Tlaib allowing her permission to visit her “grandmother.” As soon as she was granted permission she grandstanded &amp; loudly proclaimed she would not visit Israel. Could this possibly have been a setup? Israel acted appropriately!,08-16-2019 22:26:29,25515,111891,false,1162490843619635201
Twitter for iPhone,https://t.co/9WNq9PtnFY,08-16-2019 20:55:56,14946,59980,false,1162468054200139778
Twitter for iPhone,https://t.co/fJPpaVmLUZ,08-16-2019 20:54:56,11555,47694,false,1162467802906861570
Twitter for iPhone,Senator Jim Risch of the Great State of Idaho has been an incredible supporter of our Agenda! He is tough on Crime Strong on Borders and will continue to fight for our Second Amendment. Jim will never let you down. He has my Full and Complete Endorsement!,08-16-2019 17:23:59,13515,58234,false,1162414717505277952
Twitter for iPhone,Congratulations to Patrick Yoes for his election as National President of the great Fraternal Order of Police. Together we will fight for our incredible Law Enforcement Officers!,08-16-2019 15:58:36,11303,54754,false,1162393227640606720
Twitter for iPhone,Thank you to my good friend Chuck Canterbury for 16 years of service to the Fraternal Order of Police and our great men and women in blue. You are an incredible patriot!,08-16-2019 15:57:04,12349,66850,false,1162392841093636096
Twitter for iPhone,A great evening with incredible people in New Hampshire! https://t.co/XvqQCgorIW,08-16-2019 12:47:23,13331,60110,false,1162345108072742912
Twitter for iPhone,Thank you Rudy! https://t.co/u0InDTYA9f,08-16-2019 12:36:16,12498,62690,false,1162342307741523970
Twitter for iPhone,Great news! Tonight we broke the all-time attendance record previously held by Elton John at #SNHUArena in Manchester New Hampshire! https://t.co/GHvFBkA2KZ,08-16-2019 02:52:05,34530,131108,false,1162195296924946433
Twitter for iPhone,Thank you New Hampshire. KEEP AMERICA GREAT! #KAG2020 https://t.co/fbU7YYsYyI,08-16-2019 01:33:22,20975,91088,false,1162175486560280577
Twitter for iPhone,https://t.co/TCg6dLoIya,08-16-2019 01:18:43,17073,62379,false,1162171796709265408
Twitter for iPhone,Walmart a great indicator as to how the U.S. is doing just released outstanding numbers. Our Country unlike others is doing great! Don’t let the Fake News convince you otherwise.,08-15-2019 20:18:25,21483,91332,false,1162096224486510592
Twitter for iPhone,“If they don’t get this Trade Deal with the U.S. done China could have it first recession (or worse!) in years. There’s disinvestment in China right now. Also the Fed is too tight (I agree).” Steve Moore Heritage Foundation,08-15-2019 20:14:16,15431,65491,false,1162095183082729475
Twitter for iPhone,Sadly much truth to this! https://t.co/KG9HNbyrZh,08-15-2019 20:05:31,14698,49785,false,1162092980460765185
Twitter for iPhone,Andrew thank you! We will never forgive or forget. https://t.co/giSOLlCckV,08-15-2019 19:57:28,10566,43326,false,1162090952170844164
Twitter for iPhone,Biden doesn’t have a clue! I will solve the China problem. https://t.co/v0sAoVEAoB,08-15-2019 19:29:19,13773,57389,false,1162083867697852416
Twitter for iPhone,The Fake News Media is doing everything they can to crash the economy because they think that will be bad for me and my re-election. The problem they have is that the economy is way too strong and we will soon be winning big on Trade and everyone knows that including China!,08-15-2019 16:52:53,21570,80707,false,1162044502292537344
Twitter for iPhone,Representatives Omar and Tlaib are the face of the Democrat Party and they HATE Israel!,08-15-2019 16:38:24,27084,110298,false,1162040855328436225
Twitter for iPhone,Wow! The Deputy Editor of the Failing New York Times was just demoted. Should have been Fired! Totally biased and inaccurate reporting. The paper is a Fraud Zero Credibility. Fake News takes another hit but this time a big one!,08-15-2019 16:30:03,17517,71305,false,1162038755093598208
Twitter for iPhone,Our Great Farmers know how important it is to win on Trade. They will be the big winners!,08-15-2019 16:24:00,11760,56035,false,1162037232368144384
Twitter for iPhone,The United States is now by far the Biggest Strongest and Most Powerful Economy in the World it is not even close! As others falter we will only get stronger. Consumers are in the best shape ever plenty of cash. Business Optimism is at an All Time High!,08-15-2019 15:26:16,17722,76357,false,1162022701457989635
Twitter for iPhone,If President Xi would meet directly and personally with the protesters there would be a happy and enlightened ending to the Hong Kong problem. I have no doubt! https://t.co/eFxMjgsG1K,08-15-2019 14:04:34,15478,60915,false,1162002141172633600
Twitter for iPhone,It would show great weakness if Israel allowed Rep. Omar and Rep.Tlaib to visit. They hate Israel &amp; all Jewish people &amp; there is nothing that can be said or done to change their minds. Minnesota and Michigan will have a hard time putting them back in office. They are a disgrace!,08-15-2019 13:57:58,30948,118694,false,1162000480681287683
Twitter for iPhone,The Philadelphia shooter should never have been allowed to be on the streets. He had a long and very dangerous criminal record. Looked like he was having a good time after his capture and after wounding so many police. Long sentence - must get much tougher on street crime!,08-15-2019 12:59:53,18225,78463,false,1161985864412667905
Twitter for iPhone,....what they were doing. There’s plenty of indication we don’t have to speculate.” @SteveDoocy “Holy cow got to read this book.” @ainsleyearhardt “WOW!”  @foxandfriends  A very serious situation. Can never be allowed to happen again! DRAIN THE SWAMP,08-15-2019 12:26:48,15349,69038,false,1161977538022989824
Twitter for iPhone,Go out and get Andrew McCarthy’s new book “Ball of Collusion.” “Supervision became the investigator and when they pushed the envelope there was nobody there to tell them NO. It goes right to the President (Obama). Plenty of information that Obama was informed &amp; knew exactly...,08-15-2019 12:26:47,19778,80596,false,1161977535946731520
Twitter for iPhone,Thank you and the Wall is under major construction! https://t.co/jRVMxSPJzN,08-15-2019 12:00:05,19674,63195,false,1161970814922776576
Twitter for iPhone,Two great entertainers and more importantly great people! Check out their show. https://t.co/SGmbEeJuIM,08-15-2019 11:43:44,10069,41479,false,1161966700255948801
Twitter for iPhone,I know President Xi of China very well. He is a great leader who very much has the respect of his people. He is also a good man in a “tough business.” I have ZERO doubt that if President Xi wants to quickly and humanely solve the Hong Kong problem he can do it. Personal meeting?,08-14-2019 22:59:13,23461,105814,false,1161774305895694336
Twitter for iPhone,Good things were stated on the call with China the other day. They are eating the Tariffs with the devaluation of their currency and “pouring” money into their system. The American consumer is fine with or without the September date but much good will come from the short.....,08-14-2019 22:32:56,17185,88976,false,1161767689762889728
Twitter for iPhone,..deferral to December. It actually helps China more than us but will be reciprocated. Millions of jobs are being lost in China to other non-Tariffed countries. Thousands of companies are leaving. Of course China wants to make a deal. Let them work humanely with Hong Kong first!,08-14-2019 22:32:56,17069,86076,false,1161767691646115840
Twitter for iPhone,Sad! https://t.co/CP9azm8U54,08-14-2019 21:43:02,13435,51583,false,1161755131324579840
Twitter for iPhone,Unlike others our economy is strong! https://t.co/EvNRzB8GBY,08-14-2019 21:40:17,11219,46893,false,1161754440950603782
Twitter for iPhone,We are winning big time against China. Companies &amp; jobs are fleeing. Prices to us have not gone up and in some cases have come down. China is not our problem though Hong Kong is not helping. Our problem is with the Fed. Raised too much &amp; too fast. Now too slow to cut....,08-14-2019 19:21:05,18897,85916,false,1161719408202584064
Twitter for iPhone,..Spread is way too much as other countries say THANK YOU to clueless Jay Powell and the Federal Reserve. Germany and many others are playing the game! CRAZY INVERTED YIELD CURVE! We should easily be reaping big Rewards &amp; Gains but the Fed is holding us back. We will Win!,08-14-2019 19:21:05,15727,70688,false,1161719409804808193
Twitter for iPhone,The Great Charles Payne @cvpayne correctly stated that Fed Chair Jay Powell made TWO enormous mistakes. 1. When he said “mid cycle adjustment.” 2. We’re data dependent.  “He did not do the right thing.” I agree (to put it mildly!). @Varneyco,08-14-2019 17:14:50,13689,50921,false,1161687635426983937
Twitter for iPhone,Tremendous amounts of money pouring into the United States. People want safety!,08-14-2019 16:42:24,16327,86605,false,1161679474578079745
Twitter for iPhone,“So far you’ve had Tariffs imposed on 300 Billion Dollars worth of Chinese products but you can’t tell me that it has hurt our economy...&amp; it really hasn’t led to any kind of serious rise in prices at the consumer level.” @Varneyco  @FoxBusiness  And we are taking in $Billions!,08-14-2019 15:51:00,14141,57647,false,1161666538379853824
Twitter for iPhone,“The Fed has got to do something! The Fed is the Central Bank of the United States not the Central Bank of the World.” Mark Grant  @Varneyco  Correct! The Federal Reserve acted far too quickly and now is very very late. Too bad so much to gain on the upside!,08-14-2019 15:39:31,13930,52011,false,1161663651666903041
Twitter for iPhone,Join me tomorrow night in Manchester New Hampshire at 7:00 P.M. Eastern! #KAG2020 https://t.co/0UViqSlLgd,08-14-2019 15:34:36,12813,45351,false,1161662410882789376
Twitter for iPhone,A fighter and champion GREAT! https://t.co/8LoTrb6Pdc,08-14-2019 13:46:24,12095,54920,false,1161635184325877765
Twitter for iPhone,Great interview of Ron Vitiello Former Acting Ice Director by @JesseBWatters on @FoxNews about all of the work that is being (&amp; has been) done on our Southern Border. Thanks Ron terrific job! Now if only the Democrats would fix the Loopholes &amp; Asylum.,08-14-2019 02:38:24,13756,56950,false,1161467076621606912
Twitter for iPhone,Great day in the incredible Commonwealth of Pennsylvania today with the amazing energy workers construction workers and craft workers who make America run – and who make America PROUD. No one in the world does it better than YOU! https://t.co/jfWGYjzwkm,08-14-2019 01:23:32,20862,87265,false,1161448234147045376
Twitter for iPhone,No debate on Election Security should go forward without first agreeing that Voter ID (Identification) must play a very strong part in any final agreement. Without Voter ID it is all so meaningless!,08-14-2019 00:46:59,38730,141621,false,1161439036256526336
Twitter for iPhone,Thank you Bill! https://t.co/6TwDUEB7xm,08-14-2019 00:26:26,16215,62186,false,1161433863740100609
Twitter for iPhone,True! Without being stuck at an airport where CNN buys (at a big price) an uninterested audience they’ve got nothing going. @CNN is BAD for America! https://t.co/68pehXFHmx,08-13-2019 21:00:02,18576,72022,false,1161381923488436224
Twitter for iPhone,It always happens! When a Conservative does even a fraction of what Chris Cuomo did with his lunatic ranting raving &amp; cursing they get destroyed by the Fake News. But when a Liberal Democrat like Chris Cuomo does it Republicans immediately come to his defense. We never learn!,08-13-2019 20:41:33,27120,103209,false,1161377272391229440
Twitter for iPhone,See you in New Hampshire! https://t.co/NhY0QwRrkd,08-13-2019 19:45:16,11638,39318,false,1161363107039629314
Twitter for iPhone,Just leaving. Incredible Complex. JOBS! JOBS! JOBS! https://t.co/culShq7aqi,08-13-2019 19:38:46,9852,40929,false,1161361469470052353
Twitter for iPhone,So terrible! https://t.co/L9lqQIGAUp,08-13-2019 17:43:57,8545,33265,false,1161332577069760512
Twitter for iPhone,Put it back up. We are living with a Rigged &amp; Fake Media! https://t.co/ZhanbGCxuX,08-13-2019 17:32:14,19889,60724,false,1161329627853414401
Twitter for iPhone,Just landed in Pennsylvania. Looking forward to making a speech on energy. So important!,08-13-2019 17:24:54,9152,49187,false,1161327783882231809
Twitter for iPhone,Our Intelligence has informed us that the Chinese Government is moving troops to the Border with Hong Kong. Everyone should be calm and safe!,08-13-2019 17:17:18,25452,89702,false,1161325870516264961
Twitter for iPhone,Many are blaming me and the United States for the problems going on in Hong Kong. I can’t imagine why?,08-13-2019 17:11:02,21055,118907,false,1161324294800121857
Twitter for iPhone,ALL THE NEWS THAT’S NOT FIT TO PRINT! “The New York Times is no longer the paper we grew up with. It is no longer a news organization. It is now an agenda driven organization out to change the Country (for the worse!).” Michael Goodwin Highly Respected New York Post Columnist.,08-13-2019 14:53:00,19896,78922,false,1161289557079465985
Twitter for iPhone,As usual China said they were going to be buying “big” from our great American Farmers. So far they have not done what they said. Maybe this will be different!,08-13-2019 14:10:58,11632,54036,false,1161278978201661440
Twitter for iPhone,Would Chris Cuomo be given a Red Flag for his recent rant? Filthy language and a total loss of control. He shouldn’t be allowed to have any weapon. He’s nuts!,08-13-2019 14:04:43,34270,137120,false,1161277403353759744
Twitter for iPhone,Thank you Steve! https://t.co/4qwvkUTg5t,08-13-2019 13:38:44,11705,42673,false,1161270865788583936
Twitter for iPhone,Through massive devaluation of their currency and pumping vast sums of money into their system the tens of billions of dollars that the U.S. is receiving is a gift from China. Prices not up no inflation. Farmers getting more than China would be spending. Fake News won’t report!,08-13-2019 12:49:05,17124,65790,false,1161258370478858240
Twitter for iPhone,I thought Chris was Fredo also. The truth hurts. Totally lost it! Low ratings @CNN https://t.co/yBpGjt4N1T,08-13-2019 12:38:25,28871,99164,false,1161255687441342464
Twitter for iPhone,Thank you John you are a special guy! https://t.co/yAtCFcNeDL,08-13-2019 12:24:14,11801,64107,false,1161252115744010240
Twitter for iPhone,Curt Schilling a great pitcher and patriot is considering a run for Congress in Arizona. Terrific!  @foxandfriends,08-13-2019 12:16:45,15453,71928,false,1161250232316899328
Twitter for iPhone,The United States is learning much from the failed missile explosion in Russia. We have similar though more advanced technology. The Russian “Skyfall” explosion has people worried about the air around the facility and far beyond. Not good!,08-12-2019 21:26:32,18836,77730,false,1161026203345723393
Twitter for iPhone,Two great and loyal friends! https://t.co/Fo2CLjc9YZ,08-12-2019 19:47:42,29167,141149,false,1161001332469370883
Twitter for iPhone,Scaramucci who like so many others had nothing to do with my Election victory is only upset that I didn’t want him back in the Administration (where he desperately wanted to be). Also I seldom had time to return his many calls to me. He just wanted to be on TV!,08-12-2019 19:31:56,16569,82772,false,1160997363177181188
Twitter for iPhone,Thank you NEGOP! https://t.co/S5A24nleW8,08-12-2019 04:01:28,18086,85438,false,1160763205989388288
Twitter for iPhone,Many incredible things are happening right now for our Country. After years of being ripped off by other nations on both Trade Deals and the Military things are changing fast. Big progress is being made. America is respected again. KEEP AMERICA GREAT!,08-11-2019 21:42:10,28668,130437,false,1160667748978122755
Twitter for iPhone,So funny to watch Little Donny Deutsch on TV with his own failing show. When I did The Apprentice Donny would call me (along with @ErinBurnett &amp; others) and BEG to be on that VERY successful show. He had the TV “bug” &amp; I would let him come on though he (&amp; Erin) had very little..,08-11-2019 21:33:00,15658,84494,false,1160665443142643718
Twitter for iPhone,..TV talent. Then during the 2016 Election I would watch as Joe Scarborough &amp; his very angry Psycho wife(?) would push Donny to the point of total humiliation. He would never fight back because he wanted to stay on TV even on a very low rated show all in the name of ambition!,08-11-2019 21:33:00,13817,76842,false,1160665444619100160
Twitter for iPhone,Anthony Scaramucci who was quickly terminated (11 days) from a position that he was totally incapable of handling now seems to do nothing but television as the all time expert on “President Trump.” Like many other so-called television experts he knows very little about me.....,08-11-2019 02:47:04,22781,119372,false,1160382091592384513
Twitter for iPhone,.....other than the fact that this Administration has probably done more than any other Administration in its first 2 1/2 years of existence. Anthony who would do anything to come back in should remember the only reason he is on TV and it’s not for being the Mooch!,08-11-2019 02:47:04,17162,96936,false,1160382092930408449
Twitter for iPhone,Joe Biden just said “We believe in facts not truth.” Does anybody really believe he is mentally fit to be president? We are “playing” in a very big and complicated world. Joe doesn’t have a clue!,08-10-2019 22:44:06,34177,162325,false,1160320950468009984
Twitter for iPhone,Think how wonderful it is to be able to fight back and show to so many how totally dishonest the Fake News Media really is. It may be the most corrupt and disgusting business (almost) there is! MAKE AMERICA GREAT AGAIN!,08-10-2019 22:27:44,35478,153105,false,1160316831414067200
Twitter for iPhone,China wants to make a deal so badly. Thousands of companies are leaving because of the Tariffs they must stem the flow. At the same time China may be hoping for a Democrat to win so they could continue the great ripoff of America &amp; the theft of hundreds of Billions of $’s!,08-10-2019 21:58:09,19173,82161,false,1160309383701680129
Twitter for iPhone,Got to see by accident wacko comedian Bill Maher’s show - So many lies. He said patients in El Paso hospital didn’t want to meet with me. Wrong! Had really great meetings with numerous patients. Said I was on vacation. Wrong! Long planned fix up of W.H. stay here rather than..,08-10-2019 21:48:36,22813,119702,false,1160306982445887488
Twitter for iPhone,....cause big disruption by going to Manhattan. Working almost all of the time including evenings. Don’t have to be in W.H. to do that...And sooo many other false statements. He is right about one thing though. I will win again in 2020. Otherwise he pays 95% in taxes!,08-10-2019 21:48:36,20498,115655,false,1160306983376961536
Twitter for iPhone,Never has the press been more inaccurate unfair or corrupt! We are not fighting the Democrats they are easy we are fighting the seriously dishonest and unhinged Lamestream Media. They have gone totally CRAZY. MAKE AMERICA GREAT AGAIN!,08-10-2019 12:07:34,40611,169565,false,1160160760179372032
Twitter for iPhone,In a letter to me sent by Kim Jong Un he stated very nicely that he would like to meet and start negotiations as soon as the joint U.S./South Korea joint exercise are over. It was a long letter much of it complaining about the ridiculous and expensive exercises. It was.....,08-10-2019 11:58:57,20696,109733,false,1160158591518674945
Twitter for iPhone,....also a small apology for testing the short range missiles and that this testing would stop when the exercises end. I look forward to seeing Kim Jong Un in the not too distant future! A nuclear free North Korea will lead to one of the most successful countries in the world!,08-10-2019 11:58:57,18848,109130,false,1160158592483418114
Twitter for iPhone,Maggie Haberman of the Failing @nytimes reported that I was annoyed by the lack of cameras inside the hospitals in Dayton &amp; El Paso when in fact I was the one who stated very strongly that I didn’t want the Fake News inside &amp; told my people NOT to let them in. Fake reporting!,08-10-2019 11:40:48,31230,127935,false,1160154025511280640
Twitter for iPhone,Liberal Hollywood is Racist at the highest level and with great Anger and Hate! They like to call themselves “Elite” but they are not Elite. In fact it is often the people that they so strongly oppose that are actually the Elite. The movie coming out is made in order....,08-09-2019 18:44:15,37007,156971,false,1159898199802425344
Twitter for iPhone,....to inflame and cause chaos. They create their own violence and then try to blame others. They are the true Racists and are very bad for our Country!,08-09-2019 18:44:15,32021,147897,false,1159898201018834944
Twitter for iPhone,Serious discussions are taking place between House and Senate leadership  on meaningful Background Checks. I have also been speaking to the NRA and others so that their very strong views can be fully represented and respected. Guns should not be placed in the hands of.....,08-09-2019 12:03:22,19330,104386,false,1159797314900451330
Twitter for iPhone,....mentally ill or deranged people. I am the biggest Second Amendment person there is but we all must work together for the good and safety of our Country. Common sense things can be done that are good for everyone!,08-09-2019 12:03:22,17630,106974,false,1159797315680555014
Twitter for iPhone,Rod Blagojevich the former Governor of Illinois was sentenced to 14 years in prison. He has served 7 years. Many people have asked that I study the possibility of commuting his sentence in that it was a very severe one. White House staff is continuing the review of this matter.,08-08-2019 23:55:17,14118,68082,false,1159614086709227523
Twitter for iPhone,I am pleased to inform you that the Honorable Joseph Maguire current Director of the National Counterterrorism Center will be named Acting Director of National Intelligence effective August 15th. Admiral Maguire has a long and distinguished....,08-08-2019 23:12:35,18948,94575,false,1159603339363004418
Twitter for iPhone,....career in the military retiring from the U.S. Navy in 2010. He commanded at every level including the Naval Special Warfare Command. He has also served as a National Security Fellow at Harvard University. I have no doubt he will do a great job!,08-08-2019 23:12:35,13954,77225,false,1159603340667445248
Twitter for iPhone,Sue Gordon is a great professional with a long and distinguished career. I have gotten to know Sue over the past 2 years and have developed great respect for her. Sue has announced she will be leaving on August 15 which....,08-08-2019 22:19:42,12001,67479,false,1159590032514134016
Twitter for iPhone,....coincides with the retirement of Dan Coats. A new Acting Director of National Intelligence will be named shortly.,08-08-2019 22:19:42,10492,60043,false,1159590033764048896
Twitter for iPhone,....I know Emmanuel means well as do all others but nobody speaks for the United States but the United States itself. No one is authorized in any way shape or form to represent us!,08-08-2019 17:51:20,18238,89104,false,1159522493801123840
Twitter for iPhone,Iran is in serious financial trouble. They want desperately to talk to the U.S. but are given mixed signals from all of those purporting to represent us including President Macron of France....,08-08-2019 17:51:19,20366,93182,false,1159522492324687877
Twitter for iPhone,....John Deere our car companies &amp; others to compete on a level playing field. With substantial Fed Cuts (there is no inflation) and no quantitative tightening the dollar will make it possible for our companies to win against any competition. We have the greatest companies...,08-08-2019 14:38:17,14163,72832,false,1159473911748317189
Twitter for iPhone,....in the world there is nobody even close but unfortunately the same cannot be said about our Federal Reserve. They have called it wrong at every step of the way and we are still winning. Can you imagine what would happen if they actually called it right?,08-08-2019 14:38:17,15281,77522,false,1159473912616501254
Twitter for iPhone,As your President one would think that I would be thrilled with our very strong dollar. I am not! The Fed’s high interest rate level in comparison to other countries is keeping the dollar high making it more difficult for our great manufacturers like Caterpillar Boeing.....,08-08-2019 14:38:16,20673,95830,false,1159473909827297281
Twitter for iPhone,Just watched a world class loser Tim O’Brien who I haven’t seen or spoken to in many years &amp; knows NOTHING about me except that he wrote a failed hit piece book about me 15 years ago. Fired like a dog from other jobs? Saw him on Lyin’ Brian Williams Trump Slam Show. Bad TV....,08-08-2019 04:20:03,19724,111272,false,1159318329506574336
Twitter for iPhone,....I am so amazed that MSNBC &amp; CNN can keep putting on over and over again people that have no idea what I am all about and yet they speak as experts on “Trump.” Same people since long before the 2016 Election and how did that work out for the Haters and Losers. Not well!,08-08-2019 04:20:03,19748,111268,false,1159318330311880706
Twitter for iPhone,My time spent in Dayton and El Paso with some of the greatest people on earth. Thank you for a job well done! https://t.co/TNVDGhxOpo,08-08-2019 03:02:31,25845,121725,false,1159298817478414337
Twitter for iPhone,Incredible afternoon in El Paso Texas. We love you and are with you all the way! https://t.co/pTNhHapx86,08-08-2019 01:43:24,24173,103994,false,1159278905909399552
