source,text,created_at,retweet_count,favorite_count,is_retweet,id_str
Twitter for iPhone,“The lowest average jobs number for any President since 1951 4.1%. Economy doing great. If the Democrats win it is all over.” @Varneyco  @foxandfriends  I agree!,04-06-2019 13:24:51,14123,61031,false,1114519338864660483
Twitter for iPhone,THANK YOU @DHSgov @CBP and @ICEgov! https://t.co/BzNwKoUJlg,04-06-2019 01:25:17,22945,91192,false,1114338251035123715
Twitter for iPhone,Congratulations David a very big deal! https://t.co/ymtI2ueAgA,04-05-2019 23:06:42,9196,43457,false,1114303378064936960
Twitter for iPhone,Just checked out the new Wall on the Border - GREAT! Leaving now for L.A.,04-05-2019 22:16:20,17851,101022,false,1114290701334802433
Twitter for iPhone,Join me in California for a Roundtable on Immigration and Border Security! https://t.co/hLV86lWTtA,04-05-2019 20:33:09,12184,49038,false,1114264734134456321
Twitter for iPhone,Just arrived in Calexico California! https://t.co/lTChNxsHj6,04-05-2019 19:10:20,21056,88407,false,1114243892293976064
Twitter for iPhone,Will soon be landing in Calexico California to look at a portion of the new WALL being built on our Southern Border. Within two years we will have close to 400 miles built or under construction &amp; keeping our Country SAFE – not easy when the Dems are always fighting to stop you!,04-05-2019 17:48:18,17743,84958,false,1114223249917788160
Twitter for iPhone,The press is doing everything within their power to fight the magnificence of the phrase MAKE AMERICA GREAT AGAIN! They can’t stand the fact that this Administration has done more than virtually any other Administration in its first 2yrs. They are truly the ENEMY OF THE PEOPLE!,04-05-2019 17:41:29,29746,120538,false,1114221533461790721
Twitter for iPhone,“America Created 196000 Jobs in March Beating Expectations for 170000” https://t.co/TQ2LecXgfi,04-05-2019 16:58:29,11845,48581,false,1114210712522350592
Twitter for iPhone,I’ve employed thousands of Electrical Workers. They will be voting for me!,04-05-2019 16:44:58,16899,98026,false,1114207309184602112
Twitter for iPhone,Congratulations to Brian Hagedorn on his big surprise win over a well funded Liberal Democrat in the Great State of Wisconsin for a very important Supreme Court seat. Republicans are producing big for Wisconsin!,04-05-2019 16:43:48,13158,60209,false,1114207016032002048
Twitter for iPhone,JOBS! JOBS! JOBS! https://t.co/3tukVpJpzN,04-05-2019 16:03:47,16598,70225,false,1114196948397858816
Twitter for iPhone,Heading to the Southern Border to show a section of the new Wall being built! Leaving now!,04-05-2019 13:22:13,19434,103687,false,1114156288555016193
Twitter for iPhone,....This will supersede USMCA. Likewise I am looking at an economic penalty for the 500 Billion Dollars in illegal DRUGS that are shipped and smuggled through Mexico and across our Southern Border. Over 10000 Americans die each year sooo many families destroyed!,04-05-2019 13:19:46,15641,65932,false,1114155671950364677
Twitter for iPhone,....However if for any reason Mexico stops apprehending and bringing the illegals back to where they came from the U.S. will be forced to Tariff at 25% all cars made in Mexico and shipped over the Border to us. If that doesn’t work which it will I will close the Border.......,04-05-2019 13:11:36,18620,84052,false,1114153614216441856
Twitter for iPhone,The Crazed and Dishonest Washington Post again purposely got it wrong. Mexico for the first time in decades is meaningfully apprehending illegals at THEIR Southern Border before the long march up to the U.S. This is great and the way it should be. The big flow will stop.......,04-05-2019 13:04:12,16437,71103,false,1114151754722156544
Twitter for iPhone,“Trolling the Mueller Report. Democrats Lost On Collusion. Now They’re Inventing A Coverup.” @WSJopinion  James Freeman @LouDobbs,04-05-2019 11:58:46,14406,57825,false,1114135285510676480
Twitter for iPhone,I am pleased to announce that Jovita Carranza will be nominated as the new @SBAgov Administrator. She will be replacing Linda McMahon who has done an outstanding job. Jovita was a great Treasurer of the United States – and I look forward to her joining my Cabinet!,04-05-2019 00:19:56,12987,62411,false,1113959417765146624
Twitter for iPhone,.@ByronYork: “How bad does border have to be for Democrats to admit it's an emergency?” https://t.co/6LOPQQEKtP,04-04-2019 23:47:02,18778,66051,false,1113951140650074120
Twitter for iPhone,“Conservative support for Trump wall soars to 99 percent” https://t.co/Tblpox8Nsg,04-04-2019 23:45:13,23522,92552,false,1113950680283267072
Twitter for iPhone,“Democrats need to help fix the border crisis or get out of Trump’s way” https://t.co/IlQ8rbjlfg,04-04-2019 23:42:51,19784,76223,false,1113950085841412096
Twitter for iPhone,Thank you @Trish_Regan! https://t.co/6CyCpHnR6x,04-04-2019 22:55:46,19366,67356,false,1113938236504772608
Twitter for iPhone,WELCOME BACK JOE! https://t.co/b2NbBSX3sx,04-04-2019 17:53:08,77703,271730,false,1113862077842640898
Twitter for iPhone,The New York Times had no legitimate sources which would be totally illegal concerning the Mueller Report. In fact they probably had no sources at all! They are a Fake News paper who have already been forced to apologize for their incorrect and very bad reporting on me!,04-04-2019 15:04:27,24297,95229,false,1113819627212169219
Twitter for iPhone,There is nothing we can ever give to the Democrats that will make them happy. This is the highest level of Presidential Harassment in the history of our Country!,04-04-2019 12:46:27,34096,152535,false,1113784899847249921
Twitter for iPhone,According to polling few people seem to care about the Russian Collusion Hoax but some Democrats are fighting hard to keep the Witch Hunt alive. They should focus on legislation or even better an investigation of how the ridiculous Collusion Delusion got started - so illegal!,04-04-2019 12:22:54,22422,94981,false,1113778970145615878
Twitter for iPhone,Despite the unnecessary and destructive actions taken by the Fed the Economy is looking very strong the China and USMCA deals are moving along nicely there is little or no Inflation and USA optimism is very high!,04-04-2019 12:01:15,17353,76260,false,1113773525188395014
Twitter for iPhone,THE REPUBLICAN PARTY IS THE PARTY OF THE AMERICAN DREAM!,04-04-2019 11:49:18,30752,151349,false,1113770514965725186
Twitter for iPhone,The First Step Act proves that our Country can achieve amazing breakthroughs when we put politics aside and put the interests of ALL Americans FIRST. https://t.co/dTKubkIBQn https://t.co/kILIFjXglO,04-03-2019 17:09:19,23177,92598,false,1113488660777906179
Twitter for iPhone,Congress must get together and immediately eliminate the loopholes at the Border! If no action Border or large sections of Border will close. This is a National Emergency!,04-03-2019 13:45:03,28076,113272,false,1113437257493561344
Twitter for iPhone,...This will be a great campaign issue. I never asked Mitch McConnell for a vote before the Election as has been incorrectly reported (as usual) in the @nytimes but only after the Election when we take back the House etc. Republicans will always support pre-existing conditions!,04-03-2019 13:37:14,18103,75457,false,1113435291472277509
Twitter for iPhone,I was never planning a vote prior to the 2020 Election on the wonderful HealthCare package that some very talented people are now developing for me &amp; the Republican Party. It will be on full display during the Election as a much better &amp; less expensive alternative to ObamaCare...,04-03-2019 13:26:53,24665,113917,false,1113432687757484032
Twitter for iPhone,Today it was my great honor to welcome @NATO Secretary General @JensStoltenberg to the @WhiteHouse! https://t.co/4drPHXZBWH,04-02-2019 19:59:57,10441,50058,false,1113169217950543877
Twitter for iPhone,Today we celebrate the tremendous accomplishments of Americans with ASD and reaffirm our commitment to work together to ensure that every member of our society is afforded equal opportunities to reach their full potential.#WorldAutismAwarenessDay https://t.co/JQbJ2TGA3P,04-02-2019 19:42:48,15218,65957,false,1113164899251830786
Twitter for iPhone,“I haven’t seen any Democrats down here at the Border working with us or asking to speak to any of us. They have an open invitation. We are getting overrun our facilities are overcapacity. We are at an emergency crisis.” Art Del Cueto National Border Patrol Council.,04-02-2019 14:52:09,36223,125878,false,1113091756130742273
Twitter Media Studio,https://t.co/jVIodsTNNH,04-02-2019 14:51:17,12466,41620,false,1113091537553051648
Twitter for iPhone,After many years (decades) Mexico is apprehending large numbers of people at their Southern Border mostly from Guatemala Honduras and El Salvador. They have ALL been taking U.S. money for years and doing ABSOLUTELY NOTHING for us just like the Democrats in Congress!,04-02-2019 14:41:50,25372,103856,false,1113089157683953665
Twitter for iPhone,There is no amount of testimony or document production that can satisfy Jerry Nadler or Shifty Adam Schiff. It is now time to focus exclusively on properly running our great Country!,04-02-2019 12:54:11,21971,93938,false,1113062069551722496
Twitter for iPhone,Robert Mueller was a God-like figure to the Democrats until he ruled No Collusion in the long awaited $30000000 Mueller Report. Now the Dems don’t even acknowledge his name have become totally unhinged and would like to go through the whole process again. It won’t happen!,04-02-2019 12:46:29,27826,110572,false,1113060131917479936
Twitter for iPhone,World Autism Awareness Day 2019: Significance history and theme via @htTweets https://t.co/kRLZoYEIJS,04-02-2019 12:02:02,11242,45674,false,1113048943938756609
Twitter for iPhone,In 1998 Rep.Jerry Nadler strongly opposed the release of the Starr Report on Bill Clinton. No information whatsoever would or could be legally released. But with the NO COLLUSION Mueller Report which the Dems hate he wants it all. NOTHING WILL EVER SATISFY THEM! @foxandfriends,04-02-2019 11:58:10,22257,82085,false,1113047970251931648
Twitter for iPhone,....The best thing that ever happened to Puerto Rico is President Donald J. Trump. So many wonderful people but with such bad Island leadership and with so much money wasted. Cannot continue to hurt our Farmers and States with these massive payments and so little appreciation!,04-02-2019 11:45:26,18517,85911,false,1113044765405315073
Twitter for iPhone,Puerto Rico got 91 Billion Dollars for the hurricane more money than has ever been gotten for a hurricane before &amp; all their local politicians do is complain &amp; ask for more money. The pols are grossly incompetent spend the money foolishly or corruptly &amp; only take from USA....,04-02-2019 11:33:17,23821,96109,false,1113041708730802176
Twitter for iPhone,....the crazed and incompetent Mayor of San Juan have done such a poor job  of bringing the Island back to health. 91 Billion Dollars to Puerto Rico and now the Dems want to give them more taking dollars away from our Farmers and so many others. Disgraceful!,04-02-2019 03:38:29,19737,76318,false,1112922221037719552
Twitter for iPhone,....are GREAT but the politicians are incompetent or corrupt. Puerto Rico got far more money than Texas &amp; Florida combined yet their government can’t do anything right the place is a mess - nothing works. FEMA &amp; the Military worked emergency miracles but politicians like.....,04-02-2019 03:11:44,20338,83568,false,1112915488424816640
Twitter for iPhone,The Democrats today killed a Bill that would have provided great relief to Farmers and yet more money to Puerto Rico despite the fact that Puerto Rico has already been scheduled to receive more hurricane relief funding than any “place” in history. The people of Puerto Rico.....,04-02-2019 02:50:20,18606,66931,false,1112910106004504576
Twitter for iPhone,....back the House. It will be truly great HealthCare that will work for America. Also Republicans will always support Pre-Existing Conditions. The Republican Party will be known as the Party of Great HealtCare. Meantime the USA is doing better than ever &amp; is respected again!,04-02-2019 02:37:44,14725,66548,false,1112906931868520452
Twitter for iPhone,....are developing a really great HealthCare Plan with far lower premiums (cost) &amp; deductibles than ObamaCare. In other words it will be far less expensive &amp; much more usable than ObamaCare. Vote will be taken right after the Election when Republicans hold the Senate &amp; win......,04-02-2019 02:23:55,16013,71131,false,1112903454941474817
Twitter for iPhone,Everybody agrees that ObamaCare doesn’t work. Premiums &amp; deductibles are far too high - Really bad HealthCare! Even the Dems want to replace it but with Medicare for all which would cause 180 million Americans to lose their beloved private health insurance. The Republicans.....,04-02-2019 02:13:25,16911,74215,false,1112900816371900418
Twitter for iPhone,Democrats should stop fighting Sen. David Perdue’s disaster relief bill. They are blocking funding and relief for our great farmers and rural America!,04-01-2019 16:47:16,24530,93258,false,1112758339958697984
Twitter for iPhone,No matter what information is given to the crazed Democrats from the No Collusion Mueller Report it will never be good enough. Behind closed doors the Dems are laughing!,04-01-2019 14:43:14,22478,103151,false,1112727122177609729
Twitter for iPhone,The cost of ObamaCare is far too high for our great citizens. The deductibles in many cases way over $7000 make it almost worthless or unusable. Good things are going to happen! @SenRickScott  @senatemajldr @SenJohnBarrasso  @SenBillCassidy,04-01-2019 13:41:23,20566,85642,false,1112711557681762306
Twitter for iPhone,Can you believe that the Radical Left Democrats want to do our new and very important Census Report without the all important Citizenship Question. Report would be meaningless and a waste of the $Billions (ridiculous) that it costs to put together!,04-01-2019 13:03:28,31094,119727,false,1112702018383212544
Twitter for iPhone,Democrats working with Republicans in Congress can fix the Asylum and other loopholes quickly. We have a major National Emergency at our Border. GET IT DONE NOW!,04-01-2019 12:13:29,20362,86737,false,1112689440303009794
Twitter for iPhone,Now that the long awaited Mueller Report conclusions have been released most Democrats and othershave gone back to the pre-Witch Hunt phase of their lives before Collusion Delusion took over. Others are pretending that their former hero Bob Mueller no longer exists!,04-01-2019 12:07:45,18167,79464,false,1112687993528217602
Twitter for iPhone,The Democrats are allowing a ridiculous asylum system and major loopholes to remain as a mainstay of our immigration system. Mexico is likewise doing NOTHING a very bad combination for our Country. Homeland Security is being sooo very nice but not for long!,03-31-2019 23:41:52,26973,113153,false,1112500287577694208
Twitter for iPhone,“Outrageous it’s the Adam Schiff problem. People abusing the access to classified data to then go out in public and make allegations that didn’t prove to be true. You look at a decision to essentially investigate a political rival. Who made it?” James Freeman @WSJ,03-31-2019 19:39:13,23070,91119,false,1112439222147993601
Twitter for iPhone,Everybody is asking how the phony and fraudulent investigation of the No Collusion No Obstruction Trump Campaign began. We need to know for future generations to understand. This Hoax should never be allowed to happen to another President or Administration again!,03-31-2019 19:21:24,40327,172571,false,1112434738739011589
Twitter for iPhone,“The Trump Administration has succeeded in dramatically raising the costs to Iran for its sinister behavior at no cost to the U.S. or our allies. That’s the definition of a foreign-policy achievement.” Bret Stephens @nytimes  We are getting stronger all over the world watch!,03-30-2019 22:24:34,26911,115709,false,1112118445779374080
Twitter for iPhone,Mexico must use its very strong immigration laws to stop the many thousands of people trying to get into the USA. Our detention areas are maxed out &amp; we will take no more illegals. Next step is to close the Border! This will also help us with stopping the Drug flow from Mexico!,03-30-2019 20:36:30,32334,139280,false,1112091249153134598
Twitter for iPhone,It would be so easy to fix our weak and very stupid Democrat inspired immigration laws. In less than one hour and then a vote the problem would be solved. But the Dems don’t care about the crime they don’t want any victory for Trump and the Republicans even if good for USA!,03-30-2019 20:31:22,38782,160905,false,1112089959593328641
Twitter for iPhone,In honor of his past service to our Country Navy Seal #EddieGallagher will soon be moved to less restrictive confinement while he awaits his day in court. Process should move quickly! @foxandfriends @RepRalphNorman,03-30-2019 12:14:56,19923,91585,false,1111965027483951105
Twitter for iPhone,A huge thanks to @HeatherNauert for serving America at the @StateDept. Great work! I’m proud to have you join the Fulbright board! https://t.co/oq0ZaA3MID,03-30-2019 03:26:56,12566,61440,false,1111832153602564101
Twitter for iPhone,So funny that The New York Times &amp; The Washington Post got a Pulitzer Prize for their coverage (100% NEGATIVE and FAKE!) of Collusion with Russia - And there was No Collusion! So they were either duped or corrupt? In any event their prizes should be taken away by the Committee!,03-29-2019 23:25:17,35782,148994,false,1111771337519972352
Twitter for iPhone,...The problem is no matter what the Radical Left Democrats get no matter what we give them it will never be enough. Just watch they will Harass &amp; Complain &amp; Resist (the theme of their movement). So maybe we should just take our victory and say NO we’ve got a Country to run!,03-29-2019 23:15:44,29744,126060,false,1111768933651152897
Twitter for iPhone,Robert Mueller was a Hero to the Radical Left Democrats until he ruled that there was No Collusion with Russia (so ridiculous to even say!). After more than two years since the “insurance policy” statement was made by a dirty cop I got the answers I wanted the Truth.....,03-29-2019 22:31:49,27599,119739,false,1111757883568463872
Twitter for iPhone,Had the Fed not mistakenly raised interest rates especially since there is very little inflation and had they not done the ridiculously timed quantitative tightening the 3.0% GDP &amp; Stock Market would have both been much higher &amp; World Markets would be in a better place!,03-29-2019 21:41:20,20712,90586,false,1111745178824511489
Twitter for iPhone,....the Border or large sections of the Border next week. This would be so easy for Mexico to do but they just take our money and “talk.” Besides we lose so much money with them especially when you add in drug trafficking etc.) that the Border closing would be a good thing!,03-29-2019 15:43:46,22750,96039,false,1111655194658508800
Twitter for iPhone,....through their country and our Southern Border. Mexico has for many years made a fortune off of the U.S. far greater than Border Costs. If Mexico doesn’t immediately stop ALL illegal immigration coming into the United States throug our Southern Border I will be CLOSING.....,03-29-2019 15:37:09,28682,126163,false,1111653530316746752
Twitter for iPhone,The DEMOCRATS have given us the weakest immigration laws anywhere in the World. Mexico has the strongest &amp; they make more than $100 Billion a year on the U.S. Therefore CONGRESS MUST CHANGE OUR WEAK IMMIGRATION LAWS NOW &amp; Mexico must stop illegals from entering the U.S....,03-29-2019 15:23:50,26949,109670,false,1111650176345800705
Twitter for iPhone,This has been an incredible couple of weeks for AMERICA! https://t.co/bqdB7DFx8P,03-29-2019 15:09:07,20385,87495,false,1111646474952167431
Twitter for iPhone,On this Vietnam War Veterans Day we celebrate the brave Vietnam Veterans and all of America’s Veterans. Thank you for your service to our great Nation!,03-29-2019 12:48:51,27626,138352,false,1111611173131165697
Twitter for iPhone,Working hard thank you! #MAGA https://t.co/00hoL0to0u,03-29-2019 03:23:35,23412,110665,false,1111468920588791808
Twitter for iPhone,MAKE AMERICA GREAT AGAIN! https://t.co/Y6UPREMY7u https://t.co/6r7wdYDf66,03-29-2019 02:41:35,20936,85251,false,1111458352192618496
Twitter for iPhone,Massive overflow crowds in Grand Rapids Michigan tonight. Thank you for joining us tonight! #MAGA https://t.co/KQ5hTZAXsk,03-29-2019 02:30:19,35754,167501,false,1111455513936461824
Twitter for iPhone,Beautiful #MAGARally tonight in Grand Rapids Michigan - thank you I love you! MAKE AMERICA GREAT AGAIN!! https://t.co/3xlMOaaTR5,03-29-2019 01:16:18,25233,111651,false,1111436887942561792
Twitter for iPhone,On my way to Grand Rapids Michigan right now. See you all very soon! #MAGA https://t.co/JjGAijXlRT,03-28-2019 21:06:28,20924,95772,false,1111374017418559493
Twitter for iPhone,We have a National Emergency at our Southern Border. The Dems refuse to do what they know is necessary - amend our immigration laws. Would immediately solve the problem! Mexico with the strongest immigration laws in the World refuses to help with illegal immigration &amp; drugs!,03-28-2019 19:51:49,29045,113808,false,1111355230573211650
Twitter for iPhone,The Republican Party will become the Party of Great HealthCare! ObamaCare is a disaster far too expensive and deductibility ridiculously high - virtually unusable! Moving forward in Courts and Legislatively!,03-28-2019 19:41:11,21388,101128,false,1111352552615043078
Twitter Media Studio,https://t.co/3AFCELjprL,03-28-2019 16:11:27,16433,57390,false,1111299770973372416
Twitter Media Studio,https://t.co/b1bp3CGqwC,03-28-2019 15:11:47,19066,64283,false,1111284757839659008
Twitter for iPhone,Very important that OPEC increase the flow of Oil. World Markets are fragile price of Oil getting too high. Thank you!,03-28-2019 12:30:04,20134,94338,false,1111244058570248199
Twitter for iPhone,Wow ratings for “Morning Joe” which were really bad in the first place just “tanked” with the release of the Mueller Report. Likewise other shows on MSNBC and CNN have gone down by as much as 50%. Just shows Fake News never wins!,03-28-2019 11:04:04,30828,134254,false,1111222415739244546
Twitter for iPhone,Congressman Adam Schiff who spent two years knowingly and unlawfully lying and leaking should be forced to resign from Congress!,03-28-2019 10:43:13,43138,182183,false,1111217169730338816
Twitter for iPhone,FBI &amp; DOJ to review the outrageous Jussie Smollett case in Chicago. It is an embarrassment to our Nation!,03-28-2019 10:34:34,33420,139161,false,1111214993293357056
Twitter for iPhone,Mexico is doing NOTHING to help stop the flow of illegal immigrants to our Country. They are all talk and no action. Likewise Honduras Guatemala and El Salvador have taken our money for years and do Nothing. The Dems don’t care such BAD laws. May close the Southern Border!,03-28-2019 10:24:04,30563,126741,false,1111212351204835328
Twitter for iPhone,The Fake News Media is going Crazy! They are suffering a major “breakdown” have ZERO credibility or respect &amp; must be thinking about going legit. I have learned to live with Fake News which has never been more corrupt than it is right now. Someday I will tell you the secret!,03-28-2019 10:13:14,38025,160997,false,1111209625825640448
Twitter for iPhone,Will be heading to Grand Rapids Michigan tonight for a Big Rally. Will be talking about the many exciting things that are happening to our Country but also the car companies &amp; others that are pouring back into Michigan Ohio Pennsylvania North &amp; South Carolina &amp; all over!,03-28-2019 10:05:06,18135,81584,false,1111207578552406016
Twitter for iPhone,https://t.co/Tjz6ZjVV79,03-28-2019 02:40:30,21339,70143,false,1111095689642233857
Twitter for iPhone,https://t.co/lGxIGgf43F,03-27-2019 23:17:42,21931,74036,false,1111044654223552513
Twitter for iPhone,We are here today to award America’s highest military honor to a fallen hero who made the supreme sacrifice for our nation – Staff Sergeant Travis Atkins...https://t.co/q3J8BhRnhA,03-27-2019 20:48:47,18748,85406,false,1111007177190375424
Twitter for iPhone,Just met with @SundarPichai President of @Google who is obviously doing quite well. He stated strongly that he is totally committed to the U.S. Military not the Chinese Military....,03-27-2019 19:38:55,16949,90496,false,1110989594521026561
Twitter for iPhone,....Also discussed political fairness and various things that @Google can do for our Country. Meeting ended very well!,03-27-2019 19:38:55,12917,77048,false,1110989595758469120
Twitter for iPhone,https://t.co/kTXRgcuk5x,03-27-2019 19:00:12,15824,55625,false,1110979850834186246
Twitter for iPhone,.@GreggJarrett: “Trump-Russia 'collusion' was always a hoax -- and dirtiest political trick in modern US history” https://t.co/H59Q1UL64g,03-27-2019 18:47:09,19489,71687,false,1110976568296378368
Twitter for iPhone,The Fake News Media has lost tremendous credibility with its corrupt coverage of the illegal Democrat Witch Hunt of your all time favorite duly elected President me! T.V. ratings of CNN &amp; MSNBC tanked last night after seeing the Mueller Report statement. @FoxNews up BIG!,03-27-2019 01:27:21,33035,137650,false,1110714893039267840
Twitter for iPhone,https://t.co/Ing9BhBQGi,03-27-2019 01:10:51,18256,60913,false,1110710740044914688
Twitter for iPhone,https://t.co/P46CNUBicX,03-27-2019 01:09:27,16160,56109,false,1110710388927156224
