source,text,created_at,retweet_count,favorite_count,is_retweet,id_str
Twitter for iPhone,Thank you Senator @MarshaBlackburn for fighting obstructionist Democrats led by Cryin' Chuck Schumer. Democrats continue to look for a do-over on the Mueller Report and will stop at nothing to distract the American people from the great accomplishments of this Administration!,06-14-2019 21:06:27,11858,45358,false,1139640264862162944
Twitter Media Studio,The dishonest media will NEVER keep us from accomplishing our objectives on behalf of our GREAT AMERICAN PEOPLE! #MAGA https://t.co/e36YM4QCEx,06-14-2019 19:15:42,27347,93291,false,1139612393749852160
Twitter for iPhone,Announcing great expanded HRAs—big win for small employers and workers. This is a fantastic plan! My Administration has worked very hard on creating more affordable health coverage. https://t.co/DQbUfGJc1I,06-14-2019 19:14:02,12897,48821,false,1139611973644107776
Twitter for iPhone,The Radical Left Dems are working hard but THE PEOPLE are much smarter. Working hard thank you! https://t.co/KDHH5jYbGV,06-14-2019 18:51:00,14172,58172,false,1139606178680463367
Twitter for iPhone,HAPPY BIRTHDAY to our GREAT @USArmy. America loves you! #ArmyBday https://t.co/MyypBVGMoW,06-14-2019 17:03:55,19392,92516,false,1139579231468425216
Twitter for iPhone,I will be interviewed on @foxandfriends at 8:00 A.M. Enjoy! @FoxNews,06-14-2019 10:55:27,8813,50317,false,1139486504294768640
Twitter for iPhone,Natalie Harp fighting Stage 2 Cancer and doing really well was a GREAT guest on @foxandfriends. Right To Try is producing some truly spectacular results. Proud of Natalie!,06-14-2019 10:51:04,12623,63369,false,1139485397858291713
Twitter Media Studio,Thank you Jason Chaffetz! #MAGA https://t.co/sz6LiPXez6,06-14-2019 00:35:04,15927,56596,false,1139330376009166851
Twitter for iPhone,Today we announced vital new actions that we are taking to help former inmates find a job live a crime-free life and succeed beyond their dreams....https://t.co/BBQ8gpFunJ,06-13-2019 21:03:45,15592,60615,false,1139277199180259328
Twitter for iPhone,After 3 1/2 years our wonderful Sarah Huckabee Sanders will be leaving the White House at the end of the month and going home to the Great State of Arkansas....,06-13-2019 20:10:26,24596,143922,false,1139263781144596486
Twitter for iPhone,....She is a very special person with extraordinary talents who has done an incredible job! I hope she decides to run for Governor of Arkansas - she would be fantastic. Sarah thank you for a job well done!,06-13-2019 20:10:26,22062,139431,false,1139263782142787585
Twitter Media Studio,"It is the assessment of the U.S. government that Iran is responsible for today's attacks in the Gulf of Oman...."@StateDept @SecPompeo https://t.co/sTIB0p1kCE,06-13-2019 19:01:24,17256,48294,false,1139246407267815430
Twitter for iPhone,While I very much appreciate P.M. Abe going to Iran to meet with Ayatollah Ali Khamenei I personally feel that it is too soon to even think about making a deal. They are not ready and neither are we!,06-13-2019 18:21:54,17713,72757,false,1139236468365434880
Twitter for iPhone,While I very much appreciate P.M. Abe going to Iran to meet with Ayatollah Ali Khamenei I personally feel that it is too soon to even think about making a deal. They are not ready and neither are we!,06-13-2019 18:13:40,1515,5195,false,1139234395993399296
Twitter for iPhone,They’ve been wrong all along! https://t.co/z5tSV2JLEf,06-13-2019 18:01:53,20405,71292,false,1139231431023046656
Twitter for iPhone,....and other really bad people SPIED ON MY CAMPAIGN! They even had an “insurance policy” just in case Crooked Hillary Clinton and the Democrats lost their race for the Presidency! This is the biggest &amp; worst political scandal in the history of the United States of America. Sad!,06-13-2019 13:37:49,18899,74064,false,1139164977271595010
Twitter for iPhone,....which he is a member. When @RepAdamSchiff took calls from another person also very successfully purporting to be a Russian Operative did he call the FBI or even think to call the FBI? NO! The fact is that the phony Witch Hunt is a giant scam where Democrats...,06-13-2019 13:37:48,16953,65682,false,1139164973286985730
Twitter for iPhone,When Senator @MarkWarnerVA spoke at length and in great detail about extremely negative information on me with a talented entertainer purporting to be a Russian Operative did he immediately call the FBI? NO in fact he didn’t even tell the Senate Intelligence Committee of....,06-13-2019 13:37:47,19730,73143,false,1139164968862015488
Twitter for iPhone,I meet and talk to “foreign governments” every day. I just met with the Queen of England (U.K.) the Prince of Wales the P.M. of the United Kingdom the P.M. of Ireland the President of France and the President of Poland. We talked about “Everything!” Should I immediately....,06-13-2019 13:23:47,20564,101350,false,1139161442437992448
Twitter for iPhone,....call the FBI about these calls and meetings? How ridiculous! I would never be trusted again. With that being said my full answer is rarely played by the Fake News Media. They purposely leave out the part that matters.,06-13-2019 13:23:47,19007,94052,false,1139161443734106112
Twitter for iPhone,.....call the FBI about these calls and meetings? How ridiculous! I would never be trusted again. With that being said my full answer is rarely played by the Fake News Media. They purposely leave out the part that matters.,06-13-2019 12:59:57,3146,12169,false,1139155447242530816
Twitter for iPhone,I meet and talk to “foreign governments” every day. I just met with the Queen of England (U.K.) the Prince of Whales the P.M. of the United Kingdom the P.M. of Ireland the President of France and the President of Poland. We talked about “Everything!” Should I immediately.....,06-13-2019 12:59:56,3463,12720,false,1139155440959463425
Twitter for iPhone,The Dems fight us at every turn - in the meantime they are accomplishing nothing for the people! They have gone absolutely “Loco” or Unhinged as they like to say!,06-13-2019 12:11:54,17200,69033,false,1139143353445040129
Twitter for iPhone,....is not Constitutionally Permissable.” Alan Dershowitz Constitutional Lawyer,06-13-2019 11:03:25,14980,75382,false,1139126119440035842
Twitter for iPhone,“Congress cannot Impeach President Trump (did nothing wrong) because if they did they would be putting themselves above the law. The Constitution provides criteria for Impeachment - treason bribery high crimes &amp;  misdemeanors. Unless there is compelling evidence Impeachment...,06-13-2019 11:03:24,20332,94285,false,1139126117326045184
Twitter for iPhone,.....much tougher game than the Republicans did when they had the House Majority. Republicans will remember! “This has already been argued before the U.S. Supreme Court but the House doesn’t want to wait. This is a common thread between all of the Committees - do whatever you...,06-13-2019 10:51:14,10243,48565,false,1139123051788980224
Twitter for iPhone,....can to embarrass the Trump Administration (and Republicans) attack the Trump Administration. This is campaigning by the Dems.” Attorney David Bruno. So true! In the meantime they are getting NO work done on Drug Pricing Infrastructure &amp; many other things.,06-13-2019 10:51:14,11595,53903,false,1139123053219262466
Twitter for iPhone,Unrelated to Russia Russia Russia (although the Radical Left doesn’t use the name Russia anymore since the issuance of the Mueller Report) House Committee now plays the seldom used “Contempt” card on our great A.G. &amp; Sec. of Commerce - this time on the Census. Dems play a.....,06-13-2019 10:51:13,12843,57571,false,1139123048748081153
Twitter for iPhone,General Michael Flynn the 33 year war hero who has served with distinction has not retained a good lawyer he has retained a GREAT LAWYER Sidney Powell. Best Wishes and Good Luck to them both!,06-13-2019 10:21:50,22296,91292,false,1139115655532298240
Twitter for iPhone,“It’s about peace and Prosperity that’s how Republican Presidents get elected and this President has delivered on the Economy and he’s delivered on keeping America Stronger &amp; Safer. Our biggest enemy is not any one of these Democrats it’s the Media.” John McLaughlin pollster,06-13-2019 03:52:12,14211,58214,false,1139017598744576001
Twitter for iPhone,“Biden would be China’s Dream Candidate because there would be no more Tariffs no more demands that China stop stealing our IP things would go back to the old days with America’s manufacturers &amp; workers getting shafted. He has Zero Credibility!” @IngrahamAngle  So true!,06-13-2019 03:50:45,16730,66179,false,1139017233382985728
Twitter for iPhone,“It’s about peace and Properity that’s how Republican Presidents get elected and this President has delivered on the Economy and he’s delivered on keeping America Stronger and Safer. Our biggest enemy is not any one of these Democrats it’s the Media.” John McLaughlin pollster,06-13-2019 03:32:36,2057,7169,false,1139012669695025152
Twitter for iPhone,“Biden would be America’s Dream Candidate because there would be no more Tariffs no more demands that China stop stealing our IP things would go back to the old days with America’s manufacturers &amp; workers getting shafted. He has Zero Credibility!” @IngrahamAngle  So true!,06-13-2019 03:07:58,3482,12873,false,1139006468286496773
Twitter for iPhone,Thank you very much! https://t.co/UOeTBUqfhE,06-13-2019 02:45:16,10270,52611,false,1139000754021326848
Twitter for iPhone,is = if (Spell)! Not like Chris. https://t.co/wBIGo2ffzB,06-13-2019 02:44:13,6853,31132,false,1139000491919204352
Twitter for iPhone,Two Fantastic People! My friends from the very beginning. Thank you D&amp;S. https://t.co/XmyedA1WZL,06-13-2019 02:37:37,13150,56613,false,1138998830588936192
Twitter for iPhone,Our Farmers deserve this they are GREAT! https://t.co/0dFkx0vUkl,06-13-2019 02:34:23,11557,48892,false,1138998016755601408
Twitter for iPhone,Thank you! https://t.co/tagXwv2imY,06-13-2019 02:32:57,7371,35791,false,1138997658025123840
Twitter for iPhone,Michael Whatley has been with us right from the beginning. A great Leader and @NCGOP Chairman! https://t.co/XQvnK9LD8R,06-13-2019 02:27:30,5828,27650,false,1138996284046663680
Twitter for iPhone,It was a pleasure to host my friends President Andrzej Duda and Mrs. Agata Kornhauser-Duda of Poland at the @WhiteHouse today. U.S.-Poland ties are at an all-time high. Thank you for being such an exemplary Ally! https://t.co/tvhHIpsrFo,06-13-2019 00:34:26,15964,75366,false,1138967829418565632
Twitter for iPhone,The Fake News has never been more dishonest than it is today. Thank goodness we can fight back on Social Media. Their new weapon of choice is Fake Polling sometimes referred to as Suppression Polls (they suppress the numbers). Had it in 2016 but this is worse.....,06-12-2019 12:46:43,26132,110931,false,1138789726771732480
Twitter for iPhone,.....The Fake (Corrupt) News Media said they had a leak into polling done by my campaign which by the way and despite the phony and never ending Witch Hunt are the best numbers WE have ever had. They reported Fake numbers that they made up &amp; don’t even exist. WE WILL WIN AGAIN!,06-12-2019 12:46:43,20474,95706,false,1138789728189341696
Twitter for iPhone,Wow! Just got word that our June 18th Tuesday ANNOUNCEMENT in Orlando Florida already has 74000 requests for a 20000 seat Arena. With all of the big events that we have done this ticket looks to be the “hottest” of them all. See you in Florida!,06-12-2019 12:40:55,23414,101746,false,1138788269255274496
Twitter for iPhone,.....The Fake (Corrupt) News Media said they had a leak into polling done by my campaign which by the way and despite the phony and never ending Witch Hunt are the best numbers WE have ever had. They reported Fake numbers that they made up &amp; don’t even exist. WE WILL WIN AGAIN!,06-12-2019 12:19:50,7970,29588,false,1138782963733291009
Twitter for iPhone,The Fake News has never been more dishonest than it is today. Thank goodness we can fight back on Social Media. There new weapon of choice is Fake Polling sometimes referred to as Suppression Polls (they suppress the numbers). Had it in 2016 but this is worse.........,06-12-2019 12:19:49,3627,14054,false,1138782960444956673
Twitter for iPhone,Wow! Just got word that our June 18th Tuesday ANNOUNCEMENT in Orlando Florida already has 74000 requests for a 20000 seat Arena. With all of the big events that we have done this tickets looks to be the “hottest” of them all. See you in Florida!,06-12-2019 12:04:23,4497,18383,false,1138779072627183617
Twitter for iPhone,“Someone should call Obama up. The Obama Administration spied on a rival presidential campaign using Federal Agencies. I mean that seems like a headline to me?” @TuckerCarlson  It will all start coming out and the Witch Hunt will end. Presidential Harassment!,06-12-2019 04:28:40,31877,119866,false,1138664390054600705
Twitter for iPhone,Beautiful afternoon in Iowa. Thank you to all of our Nation’s Farmers. May God bless you and may God Bless America! https://t.co/VYA2bSzMWf,06-12-2019 01:21:39,19975,98546,false,1138617323898724352
Twitter for iPhone,“Trump administration gives final approval for year-round E15 use” https://t.co/WPrDiyfpIW,06-11-2019 22:20:30,11042,45524,false,1138571738772434944
Twitter for iPhone,Today here in Iowa we honor America’s cherished farming heritage. We salute your commitment to American Energy Independence — and we celebrate the bright future we are forging together powered by clean affordable AMERICAN ETHANOL! https://t.co/WhuPwrETYk,06-11-2019 21:45:32,13068,52896,false,1138562937491251200
Twitter for iPhone,On my way to Iowa - just heard nearly 1000 agriculture groups signed a letter urging Congress to approve the USMCA. Our Patriot Farmers &amp; rural America have spoken! Now Congress must do its job &amp; support these great men and women by passing the bipartisan USMCA Trade Agreement!,06-11-2019 17:44:20,19429,79048,false,1138502239109111808
Twitter for iPhone,“Why did the Democrats run if they didn’t want to do things?” @SenRickScott,06-11-2019 13:58:26,15425,67988,false,1138445389709885445
Twitter for iPhone,Good day in the Stock Market. People have no idea the tremendous potential our Country has for GROWTH - and many other things!,06-11-2019 13:55:01,14797,71559,false,1138444530020245505
Twitter for iPhone,....If Mexico produces (which I think they will). Biggest part of deal with Mexico has not yet been revealed! China is similar except they devalue currency and subsidize companies to lessen effect of 25% Tariff. So far little effect to consumer. Companies will relocate to U.S.,06-11-2019 13:14:13,12988,67770,false,1138434259637690375
Twitter for iPhone,...Companies to come to the U.S.A and to get companies that have left us for other lands to come back home. We stupidly lost 30% of our auto business to Mexico. If the Tariffs went on at the higher level they would all come back and pass. But very happy with the deal I made...,06-11-2019 13:12:17,12634,68075,false,1138433774327410688
Twitter for iPhone,Maria Dagan Steve Stuart V - When you are the big “piggy bank” that other countries have been ripping off for years (to a level that is not to be believed) Tariffs are a great negotiating tool a great revenue producers and  most importantly a powerful way to get......,06-11-2019 12:50:43,17045,86255,false,1138428346214363142
Twitter for iPhone,This is because the Euro and other currencies are devalued against the dollar putting the U.S. at a big disadvantage. The Fed Interest rate way too high added to ridiculous quantitative tightening! They don’t have a clue! https://t.co/0CpnUzJqB9,06-11-2019 12:47:09,9253,36825,false,1138427450927529984
Twitter for iPhone,The United States has VERY LOW INFLATION a beautiful thing!,06-11-2019 12:10:26,16162,87596,false,1138418208803831808
Twitter for iPhone,This is because the Euro and other currencies are devalued against the dollar putting the U.S. at a big disadvantage. The Fed Interest rate way to high added to ridiculous quantitative tightening! They don’t have a clue! https://t.co/0CpnUzJqB9,06-11-2019 12:08:30,2363,7803,false,1138417723858456576
Twitter for iPhone,Sad when you think about it but Mexico right now is doing more for the United States at the Border than the Democrats in Congress! @foxandfriends,06-11-2019 11:54:41,19140,74940,false,1138414246298042369
Twitter for iPhone,PRESIDENTIAL HARASSMENT!,06-11-2019 11:51:43,21486,95316,false,1138413497858101249
Twitter for iPhone,....investigation in the Senate. They can talk to John Dean until the cows come home we’re not doing anything in the Senate regarding the Mueller Report. We are going to harden our Infrastructure against 2020!” @LindseyGrahamSC,06-11-2019 11:49:38,13522,64815,false,1138412973649747968
Twitter for iPhone,“Mueller has spoken. He found No Collusion between the Trump Campaign and the Russians. The bottom line is what the Democrat House is doing is trying to destroy the Trump Presidency (which has been a tremendous success) and I can assure you that we’re done with the Mueller......,06-11-2019 11:49:37,16308,75734,false,1138412971846189056
Twitter for iPhone,“Jerry Nadler’s Trump Bashing Show Is A Bust.” Headline New York Post. @foxandfriends  The Greatest Witch Hunt of all time continues. All crimes were by the other side but the Committee refuses to even take a look. Deleting 33000 Emails is the real Obstruction - and much more!,06-11-2019 11:25:08,14958,57465,false,1138406809121755138
Twitter for iPhone,New book just out “The Real Deal My Decade Fighting Battles and Winning Wars With Trump” is really wonderful. It is written by two people who are very smart &amp; know me well George Sorial &amp; Damian Bates as opposed to all the books where the author has no clue who I am. ENJOY!,06-11-2019 11:14:32,14366,65915,false,1138404143222206464
Twitter for iPhone,#AmericaFIRST #MAGA🇺🇸 https://t.co/Ae51wFELD0,06-11-2019 03:41:17,11942,43899,false,1138290077740740610
Twitter for iPhone,https://t.co/RRcP8ZDy1e,06-11-2019 02:23:54,12646,42139,false,1138270602719113216
Twitter for iPhone,https://t.co/V8TxJ3KVLZ,06-11-2019 02:21:55,9737,36353,false,1138270102598684673
Twitter for iPhone,Despite the Phony Witch Hunt we will continue to MAKE AMERICA GREAT AGAIN! Thank you!! https://t.co/MXuiolM745,06-10-2019 23:01:02,26247,114122,false,1138219548979675138
Twitter for iPhone,Congratulations to the 2019 Indianapolis 500 Winner @IMS @SimonPagenaud and @Team_Penske! @IndyCar🏆🏁 https://t.co/uxhfbhJ2p0,06-10-2019 22:53:08,9650,50153,false,1138217562783830016
Twitter for iPhone,I have been briefed on the helicopter crash in New York City. Phenomenal job by our GREAT First Responders who are currently on the scene. THANK YOU for all you do 24/7/365! The Trump Administration stands ready should you need anything at all.,06-10-2019 18:52:10,17553,93465,false,1138156921901522945
Twitter for iPhone,Can’t believe they are bringing in John Dean the disgraced Nixon White House Counsel who is a paid CNN contributor. No Collusion - No Obstruction! Democrats just want a do-over which they’ll never get!,06-10-2019 18:17:37,20969,90864,false,1138148226853416962
Twitter Media Studio,Thank you @MarkLevinShow and John Eastman! https://t.co/PsoyEVynjT,06-10-2019 15:43:11,13488,49470,false,1138109362101268480
Twitter for iPhone,https://t.co/2O43Na2Nmr,06-10-2019 13:33:24,11785,45133,false,1138076700959498242
Twitter for iPhone,https://t.co/TwLPmiAB78,06-10-2019 13:33:13,11284,43379,false,1138076655266816002
Twitter for iPhone,When will the Failing New York Times admit that their front page story on the  the new Mexico deal at the Border is a FRAUD and nothing more than a badly reported “hit job” on me something that has been going on since the first day I announced for the presidency! Sick Journalism,06-10-2019 11:09:08,21252,85681,false,1138040393033895936
Twitter for iPhone,We have fully signed and documented another very important part of the Immigration and Security deal with Mexico one that the U.S. has been asking about getting for many years. It will be revealed in the not too distant future and will need a vote by Mexico’s Legislative body!..,06-10-2019 10:31:43,21290,102542,false,1138030976578310144
Twitter for iPhone,....We do not anticipate a problem with the vote but if for any reason the approval is not forthcoming Tariffs will be reinstated!,06-10-2019 10:31:43,17069,86915,false,1138030977521987584
Twitter for iPhone,Now with our new deal Mexico is doing more for the USA on Illegal Immigration than the Democrats. In fact the Democrats are doing NOTHING they want Open Borderswhich means Illigal Immigration Drugs and Crime.,06-10-2019 10:00:46,18295,72455,false,1138023190020730880
Twitter for iPhone,The Failing @nytimes story on Mexico and Illegal Immigration through our Southern Border has now been proven shockingly false and untrue bad reporting and the paper is embarrassed by it. The only problem is that they knew it was Fake News before it went out. Corrupt Media!,06-09-2019 22:57:11,18855,70571,false,1137856192343105537
Twitter for iPhone,For two years all the Democrats talked about was the Mueller Report because they knew that it was loaded up with 13 Angry Democrat Trump Haters later increased to 18. But despite the bias when the Report came out the findings were No Collusion and facts that led to........,06-09-2019 22:50:57,20211,94152,false,1137854623337893890
Twitter for iPhone,....No Obstruction. The Dems were devastated - after all this time and money spent ($40000000) the Mueller Report was a disaster for them. But they want a Redo or Do Over. They are even bringing in @CNN sleazebag attorney John Dean. Sorry no Do Overs - Go back to work!,06-09-2019 22:50:57,20679,96906,false,1137854625472765952
Twitter for iPhone,If President Obama made the deals that I have made both at the Border and for the Economy the Corrupt Media would be hailing them as Incredible &amp; a National Holiday would be immediately declared. With me despite our record setting Economy and all that I have done no credit!,06-09-2019 13:26:08,33926,158126,false,1137712485769863168
Twitter for iPhone,Twitter should let the banned Conservative Voices back onto their platform without restriction. It’s called Freedom of Speech remember. You are making a Giant Mistake!,06-09-2019 12:45:21,51046,174603,false,1137702218835136517
Twitter for iPhone,Another false report in the Failing  @nytimes. We have been trying to get some of these Border Actions for a long time as have other administrations but were not able to get them or get them in full until our signed agreement with Mexico. Additionally and for many years....,06-09-2019 12:26:37,20060,89401,false,1137697504785588225
Twitter for iPhone,.....Mexico was not being cooperative on the Border in things we had or didn’t have and now I have full confidence especially after speaking to their President yesterday that they will be very cooperative and want to get the job properly done. Importantly some things.....,06-09-2019 12:26:37,6234,22087,false,1137697505683091461
Twitter for iPhone,.....not mentioned in yesterday press release one in particular were agreed upon. That will be announced at the appropriate time. There is now going to be great cooperation between Mexico &amp; the USA something that didn’t exist for decades. However if for some unknown reason...,06-09-2019 12:26:37,15147,73931,false,1137697506454835200
Twitter for iPhone,.....there is not we can always go back to our previous very profitable position of Tariffs - But I don’t believe that will be necessary. The Failing @nytimes &amp; ratings challenged @CNN will do anything possible to see our Country fail! They are truly The Enemy of the People!,06-09-2019 12:26:37,20298,91287,false,1137697507218264064
Twitter for iPhone,I know it is not at all “Presidential” to hit back at the Corrupt Media or people who work for the Corrupt Media when they make false statements about me or the Trump Administration. Problem is if you don’t hit back people believe the Fake News is true. So we’ll hit back!,06-09-2019 04:08:26,41842,176484,false,1137572134409125890
Twitter for iPhone,Little @DonnyDeutsch whose show like his previous shoebiz tries is a disaster has been saying that I had been a friend of his. This is false. He &amp; separately @ErinBurnett used to BEG me to be on episodes of the Apprentice (both were bad) but that was it. Hardly knew him..,06-09-2019 03:54:08,12922,68458,false,1137568535977385994
Twitter for iPhone,....other than to know he was and is a total Loser. When he makes statements about me they are made up he knows nothing!,06-09-2019 03:54:08,10528,59643,false,1137568536690343936
Twitter for iPhone,Just watched the Great @Rick24Barry Basketball Hall of Famer on the @marklevinshow @FoxNews. A wonderful interview of a very smart and interesting guy by the man Mark Levin who has the number one bestselling book Unfreedom of the Press. Two Winners!,06-09-2019 00:24:14,10880,53857,false,1137515711167913984
Twitter for iPhone,Just watched the Great @RickBarry44 Backetball Hall of Famer on the @marklevinshow @FoxNews. A wonderful interview of a very smart and interesting guy by the man Mark Levin who has the number one bestselling book Unfreedom of the Press. Two Winners!,06-08-2019 23:44:39,2717,11615,false,1137505752518725632
Twitter for iPhone,Watched MSNBC this morning just to see what the opposition was saying about events of the past week. Such lies almost everything they were saying was the opposite of the truth. Fake News! No wonder their ratings along with CNN are WAY DOWN. The hatred Comcast has is amazing!,06-08-2019 23:25:11,25381,109010,false,1137500852778864645
